{"capability_bindings":[{"capability_id":"capability:engine","capability_version":"1.0.0","manifest_digest":"sha256:3333333333333333333333333333333333333333333333333333333333333333"}],"engine_receipt":{"receipt_digest":"sha256:bbbbbbbbbbbbbbbbbbbbbbbbbbbbbbbbbbbbbbbbbbbbbbbbbbbbbbbbbbbbbbbb","receipt_ref":"receipt:sha256:bbbbbbbbbbbbbbbbbbbbbbbbbbbbbbbbbbbbbbbbbbbbbbbbbbbbbbbbbbbbbbbb"},"invocation_ref":"sha256:aaaaaaaaaaaaaaaaaaaaaaaaaaaaaaaaaaaaaaaaaaaaaaaaaaaaaaaaaaaaaaaa","policy_bindings":[{"digest":"sha256:2222222222222222222222222222222222222222222222222222222222222222","policy_ref":"policy:shared","role":"plan_decision"},{"digest":"sha256:2222222222222222222222222222222222222222222222222222222222222222","policy_ref":"policy:shared","role":"task_model"},{"digest":"sha256:4444444444444444444444444444444444444444444444444444444444444444","policy_ref":"policy:invocation-admission","role":"invocation_admission"}],"schema_version":1,"source_bindings":[{"digest":"sha256:cccccccccccccccccccccccccccccccccccccccccccccccccccccccccccccccc","role":"input","source_ref":"source:input"},{"digest":"sha256:dddddddddddddddddddddddddddddddddddddddddddddddddddddddddddddddd","role":"context","source_ref":"source:context"}]}
